{
  "id": "acme-senior-software-engineer",
  "company": "Acme",
  "jobTitle": "Senior Software Engineer",
  "link": "https://careers.acme.com/jobs/senior-software-engineer",
  "currency": "USD",
  "salaryMin": 120000,
  "salaryMax": 180000,
  "rsu": 200000,
  "stockOption": "0.10% - 0.50%",
  "bonus": "10% annual target",
  "remote": "full",
  "city": "San Francisco",
  "country": "USA",
  "address": ["123 Main St, San Francisco, CA 94105"],
  "visaSponsorship": false,
  "companyDescription": "Acme Corp is a leading technology company focused on building innovative solutions for the modern web. We've been at the forefront of cloud computing and distributed systems for over a decade.",
  "teamDescription": "Join our small, agile engineering team of 8 developers. We work in a collaborative environment where everyone's input is valued. The team is responsible for building and maintaining our core platform.",
  "responsibilities": [
    "Design and build scalable APIs using Node.js and TypeScript",
    "Mentor junior engineers and conduct code reviews",
    "Collaborate with product team to define technical requirements",
    "Optimize database queries and improve system performance",
    "Participate in on-call rotation for production systems"
  ],
  "perks": [
    "Comprehensive health, dental, and vision insurance",
    "401k matching up to 6%",
    "Unlimited PTO",
    "Remote work flexibility",
    "Annual learning and development budget",
    "Top-tier equipment and home office setup"
  ],
  "keyAttributes": [
    "5+ years of backend experience with Node.js and TypeScript (essential)",
    "Experience with distributed systems and microservices (essential)",
    "Strong SQL and database optimization skills (essential)",
    "Mentorship and code review experience (nice to have)",
    "Familiarity with cloud platforms (AWS/GCP) (nice to have)"
  ],
  "referrer": {
    "name": "John Doe",
    "link": "https://linkedin.com/in/johndoe",
    "conversationSummary": "John mentioned the team is growing fast and the role has a lot of autonomy. He thinks my background is a strong fit."
  },
  "pointOfContact": {
    "name": "Jane Smith",
    "link": "https://linkedin.com/in/janesmith",
    "conversationSummary": "Jane is the engineering manager for the platform team. She emphasized the focus on developer experience and clean architecture."
  },
  "status": {
    "appliedAt": "2026-01-15",
    "introCallAt": "2026-01-22",
    "interviewsAt": ["2026-02-01", "2026-02-05"],
    "receivedOfferAt": ""
  }
}
